{
  "schema_version": "compute_job.v1",
  "job_id": "job_material_balance_site_scoped",
  "job_type": "simulation.material_balance.v1",
  "queue": "simulation",
  "request_id": "req_material_balance_site_scoped",
  "idempotency_key": "idem_material_balance_site_scoped",
  "payload": {
    "schema_version": "simulation_input.v1",
    "simulation_input_id": "si_material_balance_site_scoped",
    "process_graph_id": "pg_material_balance_site_scoped",
    "process_graph_version": 1,
    "job_type": "simulation.material_balance.v1",
    "component_schema": {
      "component_schema_id": "material_balance_components.v1",
      "components": ["COD"],
      "unit": "mg/L"
    },
    "nodes": [
      { "node_id": "n_in", "node_type": "input", "initial_volume": 1.0, "initial_concentrations": { "COD": 10.0 }, "is_inlet": true, "is_outlet": false },
      { "node_id": "n_out", "node_type": "output", "initial_volume": 1.0, "initial_concentrations": { "COD": 0.0 }, "is_inlet": false, "is_outlet": true }
    ],
    "edges": [
      { "edge_id": "e_in_out", "source_node_id": "n_in", "target_node_id": "n_out", "flow_rate": 100.0, "concentration_transform": { "COD": { "a": 1.0, "b": 0.0 } } }
    ],
    "parameters": {
      "hours": 1.0,
      "steps_per_hour": 60,
      "solver_method": "scipy_solver",
      "tolerance": 0.000001
    },
    "runtime_options": {}
  },
  "context": {
    "source_system": "autowatersimu",
    "requested_by": "user:test",
    "trace_id": "trace_material_balance_site_scoped",
    "tenant_id": "tenant_demo",
    "project_id": "project_demo",
    "site_id": "site_demo"
  },
  "execution": {
    "time_limit_sec": 600,
    "priority": "normal",
    "required_capabilities": ["material_balance", "ode"]
  },
  "created_at": "2026-05-25T00:00:00Z"
}
